{"profile_sha256":"72ab078b7e7cb80b2fea7e951172a38d0cd645eeb73214d9ea3d5dfb8e4916b1","qid":"fixture-1","router_config_sha256":"45a62c58dc9cc13d6198d56206da2e3bb33ee43b5aa637543267d4e4c8f526c7","router_id":"exact-alias-router-v1","security_scope_id":"reference-public","targets":[{"authority":"authoritative","bindings":[{"provider_id":"local-exact-lexical","required":true,"source_ids":["directory"]}],"namespace":"reference","sufficiency_rule_id":"all-required-v1","target_key":"reference:desk","target_label":"Help desk location"},{"authority":"supplemental","bindings":[{"provider_id":"local-exact-lexical","required":true,"source_ids":["notes"]}],"namespace":"reference","sufficiency_rule_id":"all-required-v1","target_key":"reference:desk-tip","target_label":"Help desk visitor tip"}],"v":1}